{"schema":"ai-news-releases/1","schemaVersion":1,"generatedAt":"2026-10-17T18:39:37Z","windowDays":90,"count":53,"releases":[{"id":"6351840e7173a109","date":"2026-10-17T14:15:01Z","company":"DeepSeek","model":"DeepSeek-v4.1-Flash","family":"DeepSeek","kind":"model","url":"https://www.reddit.com/r/LocalLLaMA/comments/1x8bb6b/deepseek_v41_flash_1017_now_leads_openweight/","source":"Reddit r/LocalLLaMA (top of day)","summary":"submitted by /u/Informal-Trouble2183 [link] [comments]","importance":20,"open":true,"alsoIn":[]},{"id":"beb6d4ec095031c6","date":"2026-10-17T07:53:58Z","company":"llama.cpp","model":"llama.cpp b11707","family":"llama.cpp","kind":"tool","url":"https://github.com/ggml-org/llama.cpp/releases/tag/b11707","source":"llama.cpp releases","summary":"model : Granite switch decision 256 options ( #30693 ) feat(convert): Attempt to come up with 256 single-token, semantic option markers Each switch model needs to identify a collection of…","importance":18,"open":null,"alsoIn":[]},{"id":"84dd8c80642d60d3","date":"2026-10-17T07:36:36Z","company":"Zhipu","model":"GLM-5.2-Base","family":"GLM","kind":"model","url":"https://pandaily.com/shanghai-ai-lab-atria-dawn-full-release-512k-context-jobbench-weights-coming-soon","source":"Pandaily","summary":"The agent model built on a 744B MoE GLM-5.2 base moves past its September preview with higher scores on JobBench, WideSearch and PaperBench. Full weights are still marked 'Coming soon'.","importance":43,"open":null,"alsoIn":[]},{"id":"92c549aca653b718","date":"2026-10-17T05:34:11Z","company":"DeepSeek","model":"DeepSeek-4.1-Flash-1017","family":"DeepSeek","kind":"model","url":"https://www.reddit.com/r/LocalLLaMA/comments/1x825su/deepseek_41_flash_1017_incoming_deepseek_users/","source":"Reddit r/LocalLLaMA (top of day)","summary":"Was waiting for this. Edit: And it just dropped: https://huggingface.co/deepseek-ai/DeepSeek-V4.1-Flash-1017 submitted by /u/chemist_slime [link] [comments]","importance":35,"open":null,"alsoIn":[]},{"id":"b53c73858966a338","date":"2026-10-17T04:26:50Z","company":"ComfyUI","model":"ComfyUI v0.41.3","family":"ComfyUI","kind":"tool","url":"https://github.com/Comfy-Org/ComfyUI/releases/tag/v0.41.3","source":"ComfyUI releases","summary":"ComfyUI v0.41.3","importance":10,"open":null,"alsoIn":[]},{"id":"7bc69a4906674350","date":"2026-10-17T02:40:38Z","company":"DeepSeek","model":"DeepSeek-v4.1-Flash-1017","family":"DeepSeek","kind":"model","url":"https://huggingface.co/deepseek-ai/DeepSeek-V4.1-Flash-1017","source":"Hugging Face: DeepSeek models","summary":"image-text-to-text · 493 likes · 0 downloads","importance":89,"open":true,"alsoIn":[{"source":"Reddit r/LocalLLaMA (top of day)","url":"https://www.reddit.com/r/LocalLLaMA/comments/1x84po4/deepseekaideepseekv41flash1017_hugging_face/"},{"source":"The Decoder","url":"https://the-decoder.com/deepseek-v4-1-flash-1017-beats-larger-rivals-in-agentic-tasks-while-once-again-massively-cutting-per-task-costs/"}]},{"id":"e11e8a57011d99eb","date":"2026-10-17T02:33:08Z","company":"llama.cpp","model":"llama.cpp b11706","family":"llama.cpp","kind":"tool","url":"https://github.com/ggml-org/llama.cpp/releases/tag/b11706","source":"llama.cpp releases","summary":"sycl: fix prompt-processing regression after Q4_0/Q8_0 weight reorder ( #30374 ) Website: https://llama.app Attestations: https://github.com/ggml-org/llama.cpp/attestations/56871404 macOS/iOS: macOS…","importance":18,"open":null,"alsoIn":[]},{"id":"4e804789b1e5dc67","date":"2026-10-16T20:53:06Z","company":"Anthropic","model":"Claude Code v2.1.302","family":"Claude Code","kind":"tool","url":"https://github.com/anthropics/claude-code/releases/tag/v2.1.302","source":"Claude Code releases","summary":"What's changed Added CLAUDE_CODE_AUTO_MODE_MODEL to choose the model the client-side auto mode classifier uses; it does not change the model for server-side auto mode Added an Idle compaction row to…","importance":18,"open":null,"alsoIn":[]},{"id":"77fa5f13ad75651f","date":"2026-10-16T20:15:50Z","company":"Alibaba","model":"Qwen 3.8","family":"Qwen","kind":"model","url":"https://www.reddit.com/r/LocalLLaMA/comments/1x7qs31/improved_qwen38flash_chat_template_w_sharp/","source":"Reddit r/LocalLLaMA (top of day)","summary":"I've been maintaining my own chat template for Qwen3.8-Flash-Next since it released, and after a discussion in another thread I decided to share it. I made a repo with my v1.4 template, the original…","importance":35,"open":null,"alsoIn":[]},{"id":"92b1113f17e7f7d5","date":"2026-10-16T18:30:41Z","company":"NVIDIA","model":"NVIDIA-Nemotron-Labs-Dory1.0-4B-NVFP4","family":"NVIDIA","kind":"model","url":"https://huggingface.co/nvidia/NVIDIA-Nemotron-Labs-Dory1.0-4B-NVFP4","source":"Hugging Face: NVIDIA models","summary":"text-generation · 0 likes · 0 downloads","importance":43,"open":true,"alsoIn":[]},{"id":"6c001d79cc46ed6c","date":"2026-10-16T18:26:53Z","company":"NVIDIA","model":"NVIDIA-Nemotron-Labs-Dory1.0-4B-MXFP8","family":"NVIDIA","kind":"model","url":"https://huggingface.co/nvidia/NVIDIA-Nemotron-Labs-Dory1.0-4B-MXFP8","source":"Hugging Face: NVIDIA models","summary":"text-generation · 0 likes · 0 downloads","importance":43,"open":true,"alsoIn":[]},{"id":"8fd8d35c31cb66ef","date":"2026-10-16T18:25:29Z","company":"NVIDIA","model":"NVIDIA-Nemotron-Labs-Dory1.0-4B-BF16","family":"NVIDIA","kind":"model","url":"https://huggingface.co/nvidia/NVIDIA-Nemotron-Labs-Dory1.0-4B-BF16","source":"Hugging Face: NVIDIA models","summary":"text-generation · 23 likes · 0 downloads","importance":55,"open":true,"alsoIn":[{"source":"Reddit r/LocalLLaMA (top of day)","url":"https://www.reddit.com/r/LocalLLaMA/comments/1x7w7dp/nvidianvidianemotronlabsdory104bbf16_hugging_face/"}]},{"id":"76862327f9b1e942","date":"2026-10-16T18:01:20Z","company":"llama.cpp","model":"llama.cpp b11699","family":"llama.cpp","kind":"tool","url":"https://github.com/ggml-org/llama.cpp/releases/tag/b11699","source":"llama.cpp releases","summary":"common: honor HTTP_PROXY/HTTPS_PROXY env vars in http client ( #21752 ) common: honor HTTP_PROXY/HTTPS_PROXY env vars in http client common_http_client() was ignoring standard proxy env vars…","importance":18,"open":null,"alsoIn":[]},{"id":"d0e6912d5b553937","date":"2026-10-16T13:53:33Z","company":"Tencent","model":"Qwen 3","family":"Qwen","kind":"model","url":"https://huggingface.co/tencent/Qwen3-8B-DSpine-b16","source":"Hugging Face: Tencent models","summary":"0 likes · 0 downloads","importance":53,"open":true,"alsoIn":[]},{"id":"895b817835a662e0","date":"2026-10-16T13:02:29Z","company":"Hugging Face","model":"Transformers v5.20.1","family":"Transformers","kind":"library","url":"https://github.com/huggingface/transformers/releases/tag/v5.20.1","source":"Transformers releases","summary":"Release v5.20.1 Special surprise including the new model Beam from Reflection AI 🥳 Beam is a token-efficient, frontier-scale model focused on coding and agentic use cases. It is built for teams…","importance":10,"open":null,"alsoIn":[]},{"id":"5b457c3572578c08","date":"2026-10-16T12:30:53Z","company":"Black Forest Labs","model":"Flux Klein 3","family":"Flux","kind":"model","url":"https://www.reddit.com/r/LocalLLaMA/comments/1x7ey7i/openmoss_releases_mossimage/","source":"Reddit r/LocalLLaMA (top of day)","summary":"There's also a base model. As all OpenMoss releases, they're Apache licensed. Wonder how this compares to Qwen Image 2.1 and Flux Klein 3. submitted by /u/ilintar [link] [comments]","importance":25,"open":null,"alsoIn":[]},{"id":"591a3b979569e267","date":"2026-10-16T04:58:24Z","company":"ComfyUI","model":"ComfyUI v0.41.2","family":"ComfyUI","kind":"tool","url":"https://github.com/Comfy-Org/ComfyUI/releases/tag/v0.41.2","source":"ComfyUI releases","summary":"ComfyUI v0.41.2","importance":10,"open":null,"alsoIn":[]},{"id":"45a99793709f0ef9","date":"2026-10-16T04:40:26Z","company":"NVIDIA","model":"Muse Spark Open 816B","family":"Muse","kind":"model","url":"https://huggingface.co/nvidia/Muse-Spark-Open-816B-A42B-DFlash2","source":"Hugging Face: NVIDIA models","summary":"image-text-to-text · 0 likes · 0 downloads","importance":43,"open":true,"alsoIn":[]},{"id":"325e9a35bcaa638d","date":"2026-10-16T02:20:01Z","company":"DeepSeek","model":"DeepSeek-v4-Pro-Base","family":"DeepSeek","kind":"model","url":"https://www.techmeme.com/261015/p59#a261015p59","source":"Techmeme","summary":"Microsoft AI : Microsoft unveils MAI-Base-2, a MoE model with 2.8T total and 80B active parameters, claiming 4x-12x more pretraining FLOPs-efficiency than DeepSeek-V4-Pro-Base — In June, we…","importance":53,"open":null,"alsoIn":[]},{"id":"9caa06df30328780","date":"2026-10-16T01:09:41Z","company":"Ollama","model":"Ollama v0.40.6","family":"Ollama","kind":"tool","url":"https://github.com/ollama/ollama/releases/tag/v0.40.6","source":"Ollama releases","summary":"What's Changed win: prevent orphaned runners by @dhiltgen in #18500 gguf: add the q2_0 tensor and file types by @jmorganca in #18967 Launch clef in Ollama's cloud by @jberg5 in #19036 use…","importance":18,"open":null,"alsoIn":[{"source":"Ollama releases","url":"https://github.com/ollama/ollama/releases/tag/v0.40.6-rc0"},{"source":"Ollama releases","url":"https://github.com/ollama/ollama/releases/tag/v0.40.6-rc1"}]},{"id":"9543599b2511f53d","date":"2026-10-15T22:57:45Z","company":"ComfyUI","model":"ComfyUI v0.41.0","family":"ComfyUI","kind":"tool","url":"https://github.com/Comfy-Org/ComfyUI/releases/tag/v0.41.0","source":"ComfyUI releases","summary":"What's Changed Add ImageSDRToHDR node. by @comfyanonymous in #16990 feat: Add a core route for the default workflow (CORE-340) by @alexisrolland in #16956 Add ReferenceMultiLatent node. by…","importance":10,"open":null,"alsoIn":[]},{"id":"7775bfba1892616e","date":"2026-10-15T19:22:06Z","company":"Anthropic","model":"Claude Code v2.1.301","family":"Claude Code","kind":"tool","url":"https://github.com/anthropics/claude-code/releases/tag/v2.1.301","source":"Claude Code releases"